{"organizations": [], "uuid": "b7c7762aa769780cc872626f009a10260a025ee7", "thread": {"social": {"gplus": {"shares": 0}, "pinterest": {"shares": 0}, "vk": {"shares": 0}, "linkedin": {"shares": 0}, "facebook": {"likes": 70, "shares": 70, "comments": 0}, "stumbledupon": {"shares": 0}}, "site_full": "www.nbcnews.com", "main_image": "http://media4.s-nbcnews.com/j/msnbc/components/video/201609/f_dc_gutierrez_hearing_160921.nbcnews-fp-1200-800.jpg", "site_section": "", "section_title": "", "url": "http://www.nbcnews.com/news/latino/latino-democratic-rep-luis-gutierrez-mocks-trumps-son-skittles-n652066", "country": "US", "domain_rank": 478, "title": "Latino Democratic Rep. Luis Gutiérrez Mocks Trump's Son With Skittles - NBC News", "performance_score": 0, "site": "nbcnews.com", "participants_count": 0, "title_full": "Latino Democratic Rep. Luis Gutiérrez Mocks Trump's Son With Skittles - NBC News", "spam_score": 0.415, "site_type": "news", "published": "2016-09-21T08:00:00.000+03:00", "replies_count": 0, "uuid": "b7c7762aa769780cc872626f009a10260a025ee7"}, "author": "Ericka N. Hernandez", "url": "http://www.nbcnews.com/news/latino/latino-democratic-rep-luis-gutierrez-mocks-trumps-son-skittles-n652066", "ord_in_thread": 0, "title": "Latino Democratic Rep. Luis Gutiérrez Mocks Trump's Son With Skittles - NBC News", "locations": [], "entities": {"persons": [{"name": "eri", "sentiment": "negative"}, {"name": "luis gutiérrez mocks trump", "sentiment": "negative"}, {"name": "gutiérrez", "sentiment": "none"}, {"name": "gutierrez", "sentiment": "none"}, {"name": "koskinen", "sentiment": "none"}, {"name": "pablo martinez monsivais", "sentiment": "none"}, {"name": "trump", "sentiment": "none"}, {"name": "john koskinen", "sentiment": "none"}, {"name": "donald trump", "sentiment": "none"}, {"name": "martinez monsivais", "sentiment": "none"}, {"name": "n. hernandez", "sentiment": "none"}, {"name": "donald trump jr.", "sentiment": "none"}, {"name": "luis gutierrez", "sentiment": "none"}, {"name": "luis gutiérrez", "sentiment": "none"}], "locations": [{"name": "united states", "sentiment": "none"}, {"name": "america", "sentiment": "none"}, {"name": "washington", "sentiment": "none"}, {"name": "r-ill.", "sentiment": "none"}, {"name": "capitol hill", "sentiment": "none"}], "organizations": [{"name": "et latino democratic", "sentiment": "negative"}, {"name": "nbc news", "sentiment": "negative"}, {"name": "house judiciary committee", "sentiment": "none"}, {"name": "trump", "sentiment": "none"}, {"name": "congress", "sentiment": "none"}, {"name": "irs", "sentiment": "none"}, {"name": "internal revenue service", "sentiment": "none"}, {"name": "house", "sentiment": "none"}, {"name": "ap", "sentiment": "none"}]}, "highlightText": "", "language": "english", "persons": [], "text": "Sep 21 2016, 3:42 pm ET Latino Democratic Rep. Luis Gutiérrez Mocks Trump's Son With Skittles by Ericka N. Hernandez Congressman Waves Bag of Skittles at House Hearing 1:23 autoplay autoplay Copy this code to your website or blog <iframe src=\"http://www.nbcnews.com/widget/video-embed/770280515827\" width=\"560\" height=\"315\" frameborder=\"0\" allowfullscreen></iframe> \nDemocratic Rep. Luis Gutiérrez used a bag of Skittles Wednesday to take aim at Donald Trump's son and his recent controversial tweet on refugees. Gutierrez said he wouldn't ban all Skittles if he got one bad one. \nRELATED: Skittles on Donald Trump Jr. Tweet: 'Skittles Are Candy. Refugees Are People' \nGutiérrez , D-IIl., held up the candy bag at a House Judiciary Committee hearing with Internal Revenue Service Commissioner John Koskinen, whom Republicans want to impeach. \n\"Every now and then,\" he said while chewing the candy, \"I will get a bad Skittle, but I don't ban them all because I get one, because most of the Skittles are pretty delicious. I like them, they might not be nutritious but they are delicious,\" Gutiérrez said. House Judiciary Committee member Rep. Luis Gutierrez, R-Ill., picks up a bag of Skittles candy after questioning IRS Commissioner John Koskinen on Capitol Hill in Washington, Wednesday, Sept. 21, 2016, during the committee's impeachment hearing. Koskinen expressed regret to Congress for his agency's past mistreatment of tea party groups, but said he has cooperated with congressional investigators and does not deserve to be impeached. (AP Photo/Pablo Martinez Monsivais) Pablo Martinez Monsivais / AP advertisement \nGutiérrez, a champion of immigration reform, was mocking a Monday night tweet by Donald Trump Jr. that used the chewy rainbow-colored candy to oppose the admission of Syrian refugees to the United States. He took note of the rainbow of colors of the candy. \n\"If I had a bowl of Skittles and I told you just three would kill you. Would you take a handful\" the image in Trump's tweet read. Trump added his own commentary, tweeting, \"This image says it all. Let's end the politically correct agenda that doesn't put America first. #trump2016 This image says it all. Let's end the politically correct agenda that doesn't put America first. #trump2016 pic.twitter.com/9fHwog7ssN ", "external_links": [], "published": "2016-09-21T08:00:00.000+03:00", "crawled": "2016-09-21T23:50:22.419+03:00", "highlightTitle": ""}