{"organizations": [], "uuid": "f54770fd5bde089b63488cdb975912a7ae31370c", "thread": {"social": {"gplus": {"shares": 0}, "pinterest": {"shares": 0}, "vk": {"shares": 0}, "linkedin": {"shares": 0}, "facebook": {"likes": 0, "shares": 0, "comments": 0}, "stumbledupon": {"shares": 0}}, "site_full": "drugpolicycentral.com", "main_image": "", "site_section": "http://drugpolicycentral.com/bot/rss", "section_title": "breaking drug news latest 25", "url": "http://drugpolicycentral.com/bot/xarticle/cbsnews8298.htm", "country": "CA", "title": "Pot debate: Using marijuana to treat PTSD and war wounds - Videos - CBS News", "performance_score": 0, "site": "drugpolicycentral.com", "participants_count": 1, "title_full": "[BOT] Pot debate: Using marijuana to treat PTSD and war wounds - Videos - CBS News", "spam_score": 0.0, "site_type": "news", "published": "2016-09-10T03:00:00.000+03:00", "replies_count": 0, "uuid": "f54770fd5bde089b63488cdb975912a7ae31370c"}, "author": "drugpolicycentral.com", "url": "http://drugpolicycentral.com/bot/xarticle/cbsnews8298.htm", "ord_in_thread": 0, "title": "Pot debate: Using marijuana to treat PTSD and war wounds - Videos - CBS News", "locations": [], "entities": {"persons": [{"name": "hillary clinton", "sentiment": "none"}, {"name": "clinton", "sentiment": "none"}, {"name": "reagan", "sentiment": "none"}, {"name": "john hinckley", "sentiment": "none"}, {"name": "tim kaine", "sentiment": "none"}, {"name": "trump", "sentiment": "none"}, {"name": "deloitte", "sentiment": "none"}, {"name": "chelsea manning", "sentiment": "none"}, {"name": "ben mezrich", "sentiment": "none"}, {"name": "obama", "sentiment": "none"}, {"name": "jr.", "sentiment": "none"}, {"name": "zika", "sentiment": "none"}, {"name": "daniel bruce  st. paul", "sentiment": "none"}], "locations": [{"name": "france", "sentiment": "none"}, {"name": "north dakota", "sentiment": "none"}, {"name": "america", "sentiment": "none"}, {"name": "us", "sentiment": "none"}, {"name": "u.s.", "sentiment": "none"}, {"name": "syria", "sentiment": "none"}, {"name": "russia", "sentiment": "none"}, {"name": "saudi arabia  clinton", "sentiment": "none"}], "organizations": [{"name": "cbs news", "sentiment": "none"}, {"name": "georgia  bush white house", "sentiment": "none"}, {"name": "cbs evening news", "sentiment": "none"}, {"name": "nfl", "sentiment": "none"}, {"name": "st paul & the broken bones  st. paul & the broken bones", "sentiment": "none"}, {"name": "gop", "sentiment": "none"}, {"name": "congress", "sentiment": "none"}, {"name": "cbs interactive inc", "sentiment": "none"}, {"name": "st. paul & the broken bones", "sentiment": "none"}, {"name": "cbs news pot", "sentiment": "none"}, {"name": "cbs", "sentiment": "none"}]}, "highlightText": "", "language": "english", "persons": [], "text": "This newsbot site, while automated (true!) has always depended on the generosity of volunteers and visitors to keep it up and running. If this site has helped you, and you can afford to help us , then we ask you to give generously. And to those who have been helping to keep us running, a heartfelt  THANK YOU!       Donate online: click here and help us out! \nUS: Pot debate: Using marijuana to treat PTSD and war wounds - Videos - CBS News \nFound: Sat Sep 10 18:08:07 2016 PDT\nWebpage: http://www.cbsnews.com/videos/pot-debate-u... [translate] \nNewshawk: http://drugpolicycentral.com/bot/ \n\n\ntopical analysis prison was NOT mentioned \npropaganda analysis \nPot debate: Using marijuana to treat PTSD and war wounds - Videos - CBS News Pot debate: Using marijuana to treat PTSD and war wounds - Videos - CBS News \n* CBS News \n* CBS Evening News \n* CBS This Morning \nShows \nNow Playing Pot debate: Using marijuana to treat PTSD and war wounds \nJohn Hinckley, Jr., would-be Reagan assassin , released from mental hospital \nCongress votes to allow 9/11 families to sue Saudi Arabia \nClinton, Trump pledge not to campaign on 9/11 anniversary \nU.S., Russia make plans for Syria cease-fire \nVP nominee Tim Kaine \n9/10: John Hinckley, Jr., would-be Reagan assassin , released from mental hospital; 9 medical research chimpanzees find retirement in Georgia \nBush White House chief of staff gives in-depth details on 9/11 \nWoman from famous WWII kissing photo dead at 92 \nGOP senator commemorates 9/11 victims, first responders \nObama honors American \"resilience\" ahead of 9/11 anniversary \nTrump: Clinton could shoot someone and not get arrested \nHillary Clinton says half of Trump's supporters are in a \"basket of deplorables\" \nInvestors hope for rebound; Trump's childhood home up for auction \nSt. Paul & The Broken Bones: \"All I Ever Wonder\" \nThe sweet sounds of St Paul & The Broken Bones \nSt. Paul & The Broken Bones: \"Waves\" \nThe Dish: Chef Daniel Bruce \nSt. Paul & The Broken Bones: \"Flow With It\" \nAmerica 's first lighthouse turning 300 \nBen Mezrich on new book about a real-life alien hunter \nWhat we can expect in the 2016 NFL season \nDeloitte announces 16 weeks of paid family leave program \nMorning Rounds: Zika fight, reducing asthma and campus cuisine \nNorth Dakota tribe's request to stop oil pipeline work denied \nSeven arrested over car filled with gas canisters in France \nWhich candidate has the foreign policy advantage? \nClinton and Trump battle over foreign policy \nEye Opener: Possible breakthrough in Syria's brutal civil war \nChelsea Manning goes on hunger strike \n* Tweet \n* Stumble \n* Email \nPot debate: Using marijuana to treat PTSD and war wounds \nRelated Videos \n* CBS Local \nGO \n* (c) 2016 CBS Interactive Inc. All rights reserved. \n* Mobile User Agreement / About CBS \n* Advertise / Closed Captioning \nThis page was seen on the cbsnews.com host.", "external_links": [], "published": "2016-09-10T03:00:00.000+03:00", "crawled": "2016-09-11T05:01:08.555+03:00", "highlightTitle": ""}