{"organizations": [], "uuid": "69f9618952a9e6814cce8ba7eaca43369adce26e", "thread": {"social": {"gplus": {"shares": 0}, "pinterest": {"shares": 0}, "vk": {"shares": 0}, "linkedin": {"shares": 0}, "facebook": {"likes": 0, "shares": 0, "comments": 0}, "stumbledupon": {"shares": 0}}, "site_full": "drugpolicycentral.com", "main_image": "", "site_section": "http://drugpolicycentral.com/bot/rss", "section_title": "breaking drug news latest 25", "url": "http://drugpolicycentral.com/bot/xarticle/cbsnews9719.htm", "country": "CA", "title": "From Hollywood movies to Trekkies, \"Star Trek\" legacy lives on 50 years later - CBS News", "performance_score": 0, "site": "drugpolicycentral.com", "participants_count": 1, "title_full": "[BOT] From Hollywood movies to Trekkies, \"Star Trek\" legacy lives on 50 years later - CBS News", "spam_score": 0.0, "site_type": "news", "published": "2016-09-07T03:00:00.000+03:00", "replies_count": 0, "uuid": "69f9618952a9e6814cce8ba7eaca43369adce26e"}, "author": "drugpolicycentral.com", "url": "http://drugpolicycentral.com/bot/xarticle/cbsnews9719.htm", "ord_in_thread": 0, "title": "From Hollywood movies to Trekkies, \"Star Trek\" legacy lives on 50 years later - CBS News", "locations": [], "entities": {"persons": [{"name": "vinita nair", "sentiment": "none"}, {"name": "trump", "sentiment": "none"}, {"name": "george takei", "sentiment": "none"}, {"name": "joseph", "sentiment": "none"}, {"name": "kirk", "sentiment": "none"}, {"name": "leonard nimoy", "sentiment": "none"}, {"name": "jemison", "sentiment": "none"}, {"name": "michael", "sentiment": "none"}, {"name": "mae jemison", "sentiment": "none"}, {"name": "bryan fuller", "sentiment": "none"}, {"name": "zika", "sentiment": "none"}, {"name": "clinton", "sentiment": "none"}, {"name": "spock", "sentiment": "none"}, {"name": "scotty", "sentiment": "none"}, {"name": "william shatner", "sentiment": "none"}], "locations": [{"name": "hollywood", "sentiment": "none"}, {"name": "united states", "sentiment": "none"}, {"name": "minnesota", "sentiment": "none"}, {"name": "us", "sentiment": "none"}, {"name": "cleveland", "sentiment": "none"}, {"name": "north korea", "sentiment": "none"}, {"name": "trekkies", "sentiment": "none"}, {"name": "portland", "sentiment": "none"}, {"name": "california", "sentiment": "none"}, {"name": "oregon", "sentiment": "none"}, {"name": "new york city", "sentiment": "none"}, {"name": "u.s.", "sentiment": "none"}, {"name": "miami beach", "sentiment": "none"}, {"name": "north vietnam", "sentiment": "none"}, {"name": "los angeles", "sentiment": "none"}], "organizations": [{"name": "cbs news", "sentiment": "none"}, {"name": "starbucks", "sentiment": "none"}, {"name": "cbs evening news", "sentiment": "none"}, {"name": "state dept.  cbs", "sentiment": "none"}, {"name": "joseph  popular  follow us", "sentiment": "none"}, {"name": "apple", "sentiment": "none"}, {"name": "cbs n", "sentiment": "none"}, {"name": "mma", "sentiment": "none"}, {"name": "smithsonian", "sentiment": "none"}, {"name": "motion picture & television country house", "sentiment": "none"}, {"name": "nasa", "sentiment": "none"}, {"name": "starship enterprise", "sentiment": "none"}, {"name": "star trek", "sentiment": "none"}, {"name": "cbs news from hollywood", "sentiment": "none"}, {"name": "cbs interactive inc", "sentiment": "none"}, {"name": "cbs news app", "sentiment": "none"}, {"name": "cbs", "sentiment": "none"}]}, "highlightText": "", "language": "english", "persons": [], "text": "This newsbot site, while automated (true!) has always depended on the generosity of volunteers and visitors to keep it up and running. If this site has helped you, and you can afford to help us , then we ask you to give generously. And to those who have been helping to keep us running, a heartfelt  THANK YOU!       Donate online: click here and help us out! \nUS: From Hollywood movies to Trekkies, \"Star Trek\" legacy lives on 50 years later - CBS News \nFound: Wed Sep 07 21:55:47 2016 PDT\nWebpage: http://www.cbsnews.com/news/star-trek-star... [translate] \nAuthor: Email Controversy\nNewshawk: http://drugpolicycentral.com/bot/ \n\n\ntopical analysis prison was NOT mentioned \npropaganda analysis \nFrom Hollywood movies to Trekkies, \"Star Trek\" legacy lives on 50 years later - CBS News From Hollywood movies to Trekkies, \"Star Trek\" legacy lives on 50 years later - CBS News \nThe all new \nCBS News App for Android. for iPad. for iPhone. \nFully redesigned. Featuring CBS N, 24/7 live news. Get the App â•³ \n* CBS News \n* CBS Evening News \n* CBS This Morning \nWWII pilot's honor \nCBS This Morning \nThe \"human computers\" who helped NASA win the space race \nCBS This Morning \nOne Italian village may hold the secret to a long life \nCBS This Morning \nStarbucks CEO shines light on \"extraordinary\" citizens \nCTM Spotify Playlist: September 7, 2016 \nCBS This Morning \nLibertarian ticket makes bold prediction if they're in debates \nCBS This Morning \nTrump compares Clinton email saga to worst political scandal in U.S. history \nCBS This Morning \nWatch \" CBS This Morning\" live from Smithsonian's new African American museum \nCBS This Morning \nShadowed by email controversy, Clinton unloads on Trump's \"scams\" \nCBS This Morning \nClinton on perceived \"blurred lines\" between her foundation and State Dept. \nCBS This Morning \nTrump on immigration policy: \"I'm not ruling out anything\" \nCBS This Morning \nMiami Beach wary of spraying Zika chemical that can \"kill anything\" \nCBS This Morning \nFifty years later, \"Star Trek\" legacy lives on and prospers \nCBS News September 3, 2016, 11:27 AM \nFifty years later, \"Star Trek\" legacy still strong \n* Comment \n* Share \n* Tweet \n* Stumble \n* Email \n1966 was a year of upheaval and change. Race riots marred American cities like Los Angeles and Cleveland, the U.S. started its bombing campaign of North Vietnam and The Beatles performed their final public concerts. The term \"Super Bowl\" hadn't yet been coined. But it was also the a year a group of little-known actors embarked on a project that would change their lives and American culture, reports \" CBS This Morning: Saturday\" co-host Vinita Nair. \n28 Photos \nEvolution of the Starship Enterprise \nThe iconic \"Star Trek\" vessel is one of the most beautifully-designed and easily-recognizable spaceships in science fiction \nFifty years ago this week, the Starship Enterprise flew into our living rooms for the first time. The original \"Star Trek\" television series ran for three years and was canceled after just 79 episodes. \nBut the science drama slowly built a cult following on syndicated television and by the end of the 1970s became a full-fledged cultural phenomenon. * WATCH: Original \"Star Trek\" episodes on CBS All Access \n* New \"Star Trek: Discovery\" series debuting on CBS All Access in January \nThat was in large part because of its willingness to tackle the moral and social issues confronting the United States at the time. The show's original cast -- including William Shatner, Leonard Nimoy and George Takei -- stayed intact as \"Star Trek\" crossed a new frontier onto the silver screen. \n33 Photos \nThe best (and worst) original \"Star Trek\" episodes \nThe sci-fi phenomenon marks its 50th anniversary; check out our rundown of the TV series' highlights and lowlights \nSix movies featuring Kirk, Spock and Scotty followed, as did a number of television spin-offs and a 21st-century Hollywood reboot with a cast not even born when that first episode aired in 1966. \nThe franchise has generated untold billions of dollars in ticket sales, merchandise and memorabilia -- much of it spent by \"Star Trek\"'s loyal fan base, the most ardent of whom became known as \"Trekkies.\" \nBut while Trekkies have sometimes been derided, they have been the ones to bring the vision of \"Star Trek\" into the realm of reality. \nPlay Video CBS N \n\"Star Trek\" celebrates 50th anniversary, shares stage with NASA \n\"Star Trek\" creators and cast members are in New York City to celebrate 50 years of exploring the prime directive. Former cast members Michael Do... \nTrekkies launched a successful write-in campaign to name NASA's first space shuttle after the first Starship Enterprise. And many real-life space travelers credit the show for inspiring them to chart their own course to the stars, including Mae Jemison, who became the first black woman in space. \n\"I thought the show was very wonderful because it was one of the first programs that had everybody, all kinds of ethnic groups, together from the United States,\" Jemison said. \nYears later, Jemison's story came full circle, when she became the first astronaut to appear in a \"Star Trek\" TV show. * Netflix snags international rights to upcoming \"Star Trek\" series \n* Producer Bryan Fuller gives details on CBS ' \"Star Trek\" reboot \nAnd now, \"Star Trek\" could be inspiring the next generation of innovators. A new series, \"Star Trek: Discovery,\" debuts this January on CBS All Access. \n(c) 2016 CBS Interactive Inc. All Rights Reserved. \n* Comment \n* Share \n* Tweet \nMore CBS This Morning \nTelevision station helps seniors heal at California retirement home \nRetired TV and film workers at the Motion Picture & Television Country House and Hospital prove they still have plenty of talent to offer with their own closed-circuit TV station \nSaturday Sessions: Joseph performs \" White Flag \" \nA sisterly trio from Portland, Oregon, goes by the unlikely name of Joseph \nPopular \nFollow Us * icon \n* icon \nThe best (and worst) original \"Star Trek\" episodes \n217654 Views \nMinnesota man confesses to 1989 assault , murder of boy \n170673 Views \nMMA fighter's baby son killed in suspected DUI hit-and-run \n79034 Views \niPhone 7: What Apple is adding - and taking away \n69623 Views \nWatch CBS N Live \nWatch CBS News anytime, anywhere with the new 24/7 digital news network. Stream CBS N live or on demand for FREE on your TV, computer, tablet, or smartphone.Watch Now \n19 Photos \nThe way it was: Today in history \n14 Photos \nVintage photos of the early days of our national parks \n24 Photos \nOn the road in North Korea", "external_links": [], "published": "2016-09-07T03:00:00.000+03:00", "crawled": "2016-09-08T08:11:32.679+03:00", "highlightTitle": ""}