{"organizations": [], "uuid": "5d59333d3c10b649dde59187eda8b7aa89577dc8", "thread": {"social": {"gplus": {"shares": 0}, "pinterest": {"shares": 0}, "vk": {"shares": 0}, "linkedin": {"shares": 0}, "facebook": {"likes": 0, "shares": 0, "comments": 0}, "stumbledupon": {"shares": 0}}, "site_full": "www.nbcnews.com", "main_image": "http://media3.s-nbcnews.com/j/newscms/2016_38/1719421/160922-moises-kaufman-mn-1315_58b936169930a7536dacd5174760135c.nbcnews-fp-1200-800.jpg", "site_section": "", "section_title": "", "url": "http://www.nbcnews.com/news/latino/these-latinos-were-honored-national-medals-art-humanities-n652546", "country": "US", "domain_rank": 478, "title": "These Latinos Were Honored with National Medals for Art, Humanities - NBC News", "performance_score": 0, "site": "nbcnews.com", "participants_count": 0, "title_full": "These Latinos Were Honored with National Medals for Art, Humanities - NBC News", "spam_score": 0.207, "site_type": "news", "published": "2016-09-22T08:00:00.000+03:00", "replies_count": 0, "uuid": "5d59333d3c10b649dde59187eda8b7aa89577dc8"}, "author": "Ericka N. Hernandez", "url": "http://www.nbcnews.com/news/latino/these-latinos-were-honored-national-medals-art-humanities-n652546", "ord_in_thread": 0, "title": "These Latinos Were Honored with National Medals for Art, Humanities - NBC News", "locations": [], "entities": {"persons": [{"name": "erick", "sentiment": "negative"}, {"name": "donald trump", "sentiment": "none"}, {"name": "barack obama", "sentiment": "none"}, {"name": "alex wong", "sentiment": "none"}, {"name": "gary cameron", "sentiment": "none"}, {"name": "n. hernandez", "sentiment": "none"}, {"name": "flaco jiménez", "sentiment": "none"}, {"name": "susan walsh", "sentiment": "none"}, {"name": "cesar chávez", "sentiment": "none"}, {"name": "jose andrés", "sentiment": "none"}, {"name": "valdez", "sentiment": "none"}, {"name": "jiménez", "sentiment": "none"}, {"name": "saul loeb", "sentiment": "none"}, {"name": "anaya", "sentiment": "none"}, {"name": "jose andres", "sentiment": "none"}, {"name": "kaufman", "sentiment": "none"}, {"name": "tony", "sentiment": "none"}, {"name": "rudolfo anaya", "sentiment": "none"}, {"name": "santiago jimenez", "sentiment": "none"}, {"name": "moisés kaufman", "sentiment": "none"}, {"name": "andees", "sentiment": "none"}, {"name": "mel brooks", "sentiment": "none"}, {"name": "ericka n. hernandez", "sentiment": "none"}, {"name": "trump", "sentiment": "none"}, {"name": "santiago jimenez jr.", "sentiment": "none"}, {"name": "dolores huerta", "sentiment": "none"}, {"name": "josé andrés", "sentiment": "none"}, {"name": "sandra cisneros", "sentiment": "none"}, {"name": "teatro campesino", "sentiment": "none"}, {"name": "obama", "sentiment": "none"}, {"name": "santiago jiménez", "sentiment": "none"}, {"name": "matthew shephard", "sentiment": "none"}, {"name": "cisneros", "sentiment": "none"}, {"name": "luis valdez", "sentiment": "none"}, {"name": "sonny baca", "sentiment": "none"}, {"name": "ritchie valens", "sentiment": "none"}], "locations": [{"name": "california", "sentiment": "none"}, {"name": "mexico", "sentiment": "none"}, {"name": "washington", "sentiment": "none"}, {"name": "u.s.", "sentiment": "none"}, {"name": "trump hotel  andrés", "sentiment": "none"}, {"name": "chicanos", "sentiment": "none"}, {"name": "white house", "sentiment": "none"}, {"name": "u.s", "sentiment": "none"}, {"name": "texas", "sentiment": "none"}, {"name": "el paso u.s.", "sentiment": "none"}, {"name": "d.c.", "sentiment": "none"}, {"name": "washington, dc", "sentiment": "none"}], "organizations": [{"name": "national medals for art", "sentiment": "negative"}, {"name": "nbc news", "sentiment": "negative"}, {"name": "reuters  anaya", "sentiment": "none"}, {"name": "national humanities medal", "sentiment": "none"}, {"name": "national medal of art and humanities", "sentiment": "none"}, {"name": "white house", "sentiment": "none"}, {"name": "national endowment", "sentiment": "none"}, {"name": "house", "sentiment": "none"}, {"name": "nbc latino on facebook", "sentiment": "none"}, {"name": "instagram", "sentiment": "none"}, {"name": "ap  jiménez", "sentiment": "none"}, {"name": "teatro campesino", "sentiment": "none"}]}, "highlightText": "", "language": "english", "persons": [], "text": "Sep 22 2016, 2:35 pm ET These Latinos Were Honored with National Medals for Art, Humanities by Ericka N. Hernandez advertisement \nSome of the most notable Latino artists, musicians and writers were recognized by the White House for their cultural contributions. \nPresident Barack Obama awarded the National Medal of Art and Humanities to five renowned Hispanics who have played key roles in elevating the experiences, culture and art of Latinos and weaving them into American society through their body of work. Their work has broken barriers, helped tell the civil rights struggles of Latinos, expanded the understanding of Latinos in the U.S. and added to the many dimensions of the American mosaic. Play Mel Brooks Jokes Around at White House Medal Ceremony 0:49 autoplay autoplay Copy this code to your website or blog <iframe src=\"http://www.nbcnews.com/widget/video-embed/771124291779\" width=\"560\" height=\"315\" frameborder=\"0\" allowfullscreen></iframe> \n\"We believe that the arts and the humanities are in many ways reflective of our national soul. They're central to who we are as Americans: dreamers and storytellers and innovators and visionaries,\" Obama said. advertisement \nFour received the National Medal of Arts : Author Sandra Cisneros , conjunto musician Santiago Jimenez Jr., film director, actor and civil rights activist Luis Valdez and playwright Moisés Kaufman. \nThe two recipients of the National Humanities Medal were Rudolfo Anaya, known as the father or sometimes godfather of Chicano literature, and acclaimed chef and humanitarian José Andrés. Author Sandra Cisneros is presented with the National Medal of Arts during an East Room ceremony at the White House on Sept. 22. Alex Wong / Getty Images \nCisneros, the award-winning author of several books such as \"The House on Mango Street\" has tackled issues of race, gender and class \"through the lives of ordinary people straddling multiple cultures,\" as the White House stated when they first announced the medal. advertisement President Barack Obama presents musician Santiago Jimenez, Jr., with the 2015 National Medal of Arts during a ceremony in the East Room of the White House in Washington, Thursday, Sept. 22, 2016. Susan Walsh / AP \nJiménez is one of the best-known \"conjunto\" artists, a unique style born in Texas that is anchored by the accordian. The genre that blends the sounds of the American southwest and Mexico, was also made famous by his father, Santiago Jiménez. \nJiménez won a National Heritage Fellowship for his lifetime achievement. Apart from his father, his brother is accordionist Flaco Jiménez, who has won six Grammy Awards, including a 2015 Lifetime Achievement Award and a National Heritage Fellowship from the National Endowment of the Arts. advertisement \nValdez, a director, playwright, actor and writer, was honored for bringing Chicano culture to the American public through works like \"Zoot Suit,\" which told the trial of Chicanos who were beaten and stripped of their zoot suits in racially-motivated attacks and the award-winning movie \"La Bamba,\" a biopic about rock 'n roll musician Ritchie Valens. \nHe also founded \"Teatro Campesino\" which \"created and performed \"actos\" or short skits on flatbed trucks and helped dramatize the struggles of the nation's farmworkers. First staged during the California grape boycotts organized by Cesar Chávez and Dolores Huerta, the Teatro performed across the U.S. and Mexico. Teatro Campesino is considered an integral part of the Chicano civil rights struggle. \nKaufman, Award-winning playwright and director, was recognized for his contributions to American theater. \n\"His work sensitively probes questions of culture and sexuality,\" stated the White House when they announced the medal. Kaufman, who is Venezuelan-American, has been nominated for an Emmy and a Tony. One of his best-known works, made into a play and a movie, is \"The Laramie Project,\" based on the real-life death of Matthew Shephard, a young gay college student who was tortured, beaten and left to die. His death galvanized proponents of hate crime legislation. U.S. President Barack Obama awards the 2015 National Humanities Medal to author Rudolfo Anaya (R) at the White House in Washington, U.S., September 22, 2016. GARY CAMERON / Reuters \nAnaya received the National Humanities Medal for his portrayal of the American southwest and the depiction of the Chicano experience. advertisement \nThe novelist is best known for his seminal novel \"Bless Me, Ultima,\" for which he won the Quinto Sol award. Considered a literature classic, it was recently made into a movie. \nOther works by him include \"Heart of Aztlán\" and \"Tortuga \" and the Sonny Baca series of detective novels. Anaya received the National Medal of Arts in 2003. \nRELATED: Rudolfo Anaya's \"Bless Me Ultima\" to premiere on the big screen in El Paso U.S. President Barack Obama presents chef Jose Andres with the 2015 National Humanities Medal during a ceremony in the East Room of the White House in Washington, DC, September 22, 2016. SAUL LOEB / AFP - Getty Images \nAndrés , a Spanish American, received the National Humanities medal for his innovative food techniques as well as his emphasis on addressing issues of hunger and food insecurity. He was named one of Time 100's most influential people and has received the James Beard Award. Andees also worked closely with the White House on immigration reform issues. \nRELATED: Jose Andrés Dumps Planned Restaurant at Trump Hotel \nAndrés made headlines in 2015 when he withdrew plans to open one of his restaurants at Donald Trump's new hotel in Washington, D.C. following Trump's comments about Mexico sending \"criminals\" and \"rapists\" to the U.S. He was subsequently sued by Trump. \nFollow NBC Latino on Facebook , Twitter and Instagram . Ericka N. Hernandez ", "external_links": [], "published": "2016-09-22T08:00:00.000+03:00", "crawled": "2016-09-23T01:50:17.146+03:00", "highlightTitle": ""}