{"organizations": [], "uuid": "15520a9e4543cf2a607f3544cb5d8eed0dbb1399", "thread": {"social": {"gplus": {"shares": 0}, "pinterest": {"shares": 0}, "vk": {"shares": 0}, "linkedin": {"shares": 0}, "facebook": {"likes": 0, "shares": 0, "comments": 0}, "stumbledupon": {"shares": 0}}, "site_full": "www.nbcnews.com", "main_image": "http://media2.s-nbcnews.com/j/newscms/2016_37/1711221/160915-clinton-hispanic-caucus-mbe-953p_3_140f0b3f7f77bb9af250e6cd926910db.nbcnews-fp-1200-800.jpg", "site_section": "", "section_title": "", "url": "http://www.nbcnews.com/politics/2016-election/clinton-slams-trump-bigotry-after-non-answer-obama-birthplace-n649236", "country": "US", "domain_rank": 478, "title": "Clinton Accuses Trump of 'Bigotry' for Silence on Obama's Birthplace - NBC News", "performance_score": 0, "site": "nbcnews.com", "participants_count": 0, "title_full": "Clinton Accuses Trump of 'Bigotry' for Silence on Obama's Birthplace - NBC News", "spam_score": 0.115, "site_type": "news", "published": "2016-09-16T08:00:00.000+03:00", "replies_count": 0, "uuid": "15520a9e4543cf2a607f3544cb5d8eed0dbb1399"}, "author": "Monica Alba", "url": "http://www.nbcnews.com/politics/2016-election/clinton-slams-trump-bigotry-after-non-answer-obama-birthplace-n649236", "ord_in_thread": 0, "title": "Clinton Accuses Trump of 'Bigotry' for Silence on Obama's Birthplace - NBC News", "locations": [], "entities": {"persons": [{"name": "mon", "sentiment": "negative"}, {"name": "clinton accuses trump", "sentiment": "negative"}, {"name": "obama", "sentiment": "negative"}, {"name": "kellyanne conway", "sentiment": "none"}, {"name": "donald trump", "sentiment": "none"}, {"name": "barack obama", "sentiment": "none"}, {"name": "trump", "sentiment": "none"}, {"name": "hillary clinton", "sentiment": "none"}, {"name": "clinton", "sentiment": "none"}, {"name": "conway", "sentiment": "none"}, {"name": "stephen colbert", "sentiment": "none"}, {"name": "rudy giuliani", "sentiment": "none"}, {"name": "alba clinton hits trump over 'birther", "sentiment": "none"}, {"name": "giuliani", "sentiment": "none"}, {"name": "brian fallon", "sentiment": "none"}, {"name": "monica alba", "sentiment": "none"}, {"name": "jason miller", "sentiment": "none"}, {"name": "chris matthews", "sentiment": "none"}], "locations": [{"name": "united states", "sentiment": "none"}, {"name": "u.s.", "sentiment": "none"}, {"name": "washington", "sentiment": "none"}, {"name": "washington, d.c", "sentiment": "none"}, {"name": "washington", "sentiment": "none"}, {"name": "hawaii", "sentiment": "none"}], "organizations": [{"name": "nbc news", "sentiment": "negative"}, {"name": "msnbc", "sentiment": "none"}, {"name": "d.c.  trump", "sentiment": "none"}, {"name": "trump", "sentiment": "none"}, {"name": "gop", "sentiment": "none"}, {"name": "washington post", "sentiment": "none"}, {"name": "congressional hispanic caucus institute", "sentiment": "none"}]}, "highlightText": "", "language": "english", "persons": [], "text": "Sep 15 2016, 11:06 pm ET Clinton Accuses Trump of 'Bigotry' for Silence on Obama's Birthplace by Monica Alba Clinton Hits Trump Over 'Birther' Claims 1:02 autoplay autoplay Copy this code to your website or blog <iframe src=\"http://www.nbcnews.com/widget/video-embed/766425155634\" width=\"560\" height=\"315\" frameborder=\"0\" allowfullscreen></iframe> \nWASHINGTON — Hillary Clinton slammed Donald Trump on Thursday for again declining to answer a question about where President Barack Obama was born, asking: \"When will he stop this ugliness, this bigotry?\" \n\"He's tried to reset himself and his campaign many times. This is the best he can do. This is who he is so we need to decide who we are,\" Clinton said at The Congressional Hispanic Caucus Institute awards gala in Washington, D.C. \nTrump late Wednesday in an interview with the Washington Post declined to say if he believes Obama was born in Hawaii. \"I'll answer that question at the right time,\" Trump said. \"I just don't want to answer it yet.\" The interview was published Thursday. \nRelated: Trump Again Refuses to Say Obama Was Born in U.S. \nTrump's campaign countered late Thursday that the candidate does believe Obama was born in the U.S., despite Trump's continued refusal to explicitly say so himself when questioned over the last year. \n\"Having successfully obtained President Obama's birth certificate when others could not, Mr. Trump believes that President Obama was born in the United States,\" Trump campaign spokesman Jason Miller said in a statement Thursday night. \nClinton's campaign was not convinced. Campaign spokesman Brian Fallon said \"Trump needs to say it himself.\" — Brian Fallon (@brianefallon) September 16, 2016 \nTrump famously questioned Obama's birthplace, leading Obama to release his birth certificate in 2011. Play Clinton Returns to Campaign Trail, as Polls Show Trump Surging 1:54 autoplay autoplay Copy this code to your website or blog <iframe src=\"http://www.nbcnews.com/widget/video-embed/766279747773\" width=\"560\" height=\"315\" frameborder=\"0\" allowfullscreen></iframe> \nClinton in a speech at The Congressional Hispanic Caucus Institute awards gala in Washington, D.C, shortly before the Trump campaign spokesman's statement seized on Trump's recent non-answer. advertisement \n\"When will he stop this ugliness, this bigotry?\" Clinton asked the crowd. \n\"He's tried to reset himself and his campaign many times. This is the best he can do. This is who he is so we need to decide who we are,\" Clinton said. \n\"If we just sigh and shake our heads and accept this, then what does that tell our kids about who we are?\" Clinton said. \"We need to stand up and repudiate divisive rhetoric. We need to stop him conclusively in November in an election that sends a message that even he can hear.\" \nTrump has on several occasions over the last year declined to comment on his prior questions about Obama's birthplace. \nTrump in September of 2015 told \"Late Show\" Stephen Colbert said \"I don't talk about it anymore\" in response to a question about Obama's birthplace, and the GOP nominee gave a similar answer to MSNBC's Chris Matthews in December. advertisement \nBut in the last week by Trump campaign manager Kellyanne Conway and adviser Rudy Giuliani that Trump now believes Obama was born in the U.S. Trump did not dispute Conway's statement during his interview with the Washington Post. \nThe Congressional Hispanic Caucus Institute awards gala marked Clinton's second event back on the trail after a bout with pneumonia that sidelined her for three days. \nObama spoke before Clinton's speech Thursday. He criticized Trump for his proposed \"wall\" on the U.S.-Mexico border, and said immigration reform can't be tackled by one leader. \n\"It's gonna take all of us. This is not something that a president can do alone. It's not something the next president will be able to do alone either, no matter how tough she is,\" Obama said, making an obvious reference to his preferred successor. \nRelated: Donald Trump Accepts Barack Obama Born Was Born in U.S., Giuliani Says \nIn her opening remarks, Clinton made a pointed joked about a Latino Trump surrogate who warned that taco trucks would be \"on every corner\" if Trump isn't elected president. \n\"I personally think a taco truck on every corner sounds absolutely delicious,\" she said to laughs in the convention center hall. \nThe former secretary of state also reiterated her commitment to introducing comprehensive immigration reform in her first 100 days in office, if elected. \n\"Fighting for kids and families. That's been the cause of my life. It will be the passion of my presidency,\" she said. Monica Alba ", "external_links": [], "published": "2016-09-16T08:00:00.000+03:00", "crawled": "2016-09-16T07:33:50.996+03:00", "highlightTitle": ""}