{"organizations": [], "uuid": "94c3739162f475a974f1165fa908b059b957d563", "thread": {"social": {"gplus": {"shares": 0}, "pinterest": {"shares": 0}, "vk": {"shares": 0}, "linkedin": {"shares": 0}, "facebook": {"likes": 0, "shares": 0, "comments": 0}, "stumbledupon": {"shares": 0}}, "site_full": "drugpolicycentral.com", "main_image": "", "site_section": "http://drugpolicycentral.com/bot/rss", "section_title": "breaking drug news latest 25", "url": "http://drugpolicycentral.com/bot/xarticle/cbsnews9647.htm", "country": "CA", "title": "Missouri woman who lived with needle lodged in back wins large judgment - CBS News", "performance_score": 0, "site": "drugpolicycentral.com", "participants_count": 1, "title_full": "[BOT] Missouri woman who lived with needle lodged in back wins large judgment - CBS News", "spam_score": 0.0, "site_type": "news", "published": "2016-09-05T03:00:00.000+03:00", "replies_count": 0, "uuid": "94c3739162f475a974f1165fa908b059b957d563"}, "author": "drugpolicycentral.com", "url": "http://drugpolicycentral.com/bot/xarticle/cbsnews9647.htm", "ord_in_thread": 0, "title": "Missouri woman who lived with needle lodged in back wins large judgment - CBS News", "locations": [], "entities": {"persons": [{"name": "ball", "sentiment": "none"}, {"name": "trump", "sentiment": "none"}, {"name": "joey", "sentiment": "none"}, {"name": "jacob wetterling", "sentiment": "none"}, {"name": "catherine doty", "sentiment": "none"}, {"name": "rory feek", "sentiment": "none"}, {"name": "kerri walsh jennings", "sentiment": "none"}, {"name": "ryan gavin", "sentiment": "none"}, {"name": "claudia ball", "sentiment": "none"}, {"name": "obama", "sentiment": "none"}], "locations": [{"name": "missouri", "sentiment": "none"}, {"name": "minnesota", "sentiment": "none"}, {"name": "us", "sentiment": "none"}, {"name": "chesterfield", "sentiment": "none"}, {"name": "mexico city  trump", "sentiment": "none"}, {"name": "mo.", "sentiment": "none"}, {"name": "clayton", "sentiment": "none"}, {"name": "st. louis county", "sentiment": "none"}, {"name": "chicago", "sentiment": "none"}, {"name": "atlantic coast", "sentiment": "none"}, {"name": "detroit", "sentiment": "none"}, {"name": "mexico", "sentiment": "none"}, {"name": "u.s.", "sentiment": "none"}, {"name": "east coast", "sentiment": "none"}, {"name": "ohio", "sentiment": "none"}], "organizations": [{"name": "cbs news", "sentiment": "none"}, {"name": "cbs evening news", "sentiment": "none"}, {"name": "trump", "sentiment": "none"}, {"name": "fsu", "sentiment": "none"}, {"name": "doty and allied physicians group", "sentiment": "none"}, {"name": "cbs n", "sentiment": "none"}, {"name": "allied physicians group llc", "sentiment": "none"}, {"name": "breakthrough pain relief clinic", "sentiment": "none"}, {"name": "fbi", "sentiment": "none"}, {"name": "st. louis post-dispatch", "sentiment": "none"}, {"name": "associated press", "sentiment": "none"}, {"name": "cbs / ap", "sentiment": "none"}, {"name": "cbs interactive inc", "sentiment": "none"}, {"name": "cbs news app", "sentiment": "none"}, {"name": "cbs", "sentiment": "none"}]}, "highlightText": "", "language": "english", "persons": [], "text": "This newsbot site, while automated (true!) has always depended on the generosity of volunteers and visitors to keep it up and running. If this site has helped you, and you can afford to help us , then we ask you to give generously. And to those who have been helping to keep us running, a heartfelt  THANK YOU!       Donate online: click here and help us out! \nUS: Missouri woman who lived with needle lodged in back wins large judgment - CBS News \nFound: Mon Sep 05 22:02:27 2016 PDT\nWebpage: http://www.cbsnews.com/news/missouri-woman... [translate] \nNewshawk: http://drugpolicycentral.com/bot/ \n\n\ntopical analysis prison was NOT mentioned \npropaganda analysis \nMissouri woman who lived with needle lodged in back wins large judgment - CBS News Missouri woman who lived with needle lodged in back wins large judgment - CBS News \nThe all new \nCBS News App for Android. for iPad. for iPhone. \nFully redesigned. Featuring CBS N, 24/7 live news. Get the App â•³ \n* CBS News \n* CBS Evening News \n* CBS This Morning \nCBS / AP September 5, 2016, 8:45 PM \nMissouri woman who lived with needle lodged in back wins large judgment \n* Comment \n* Share \n* Tweet \n* Stumble \n* Email \nCLAYTON, Mo. -- A Missouri woman who has lived with a hypodermic needle lodged in her back for nearly seven years has been awarded a $507,000 judgment in a medical malpractice lawsuit. \nThe St. Louis Post-Dispatch reports that a St. Louis County jury last week sided with Claudia Ball after a four-day trial. \nIn 2011, Ball sued Dr. Catherine Doty and the Allied Physicians Group LLC, which ran the now-closed Breakthrough Pain Relief Clinic in Chesterfield. \nBall accused the doctor of negligence for embedding an inch-and-a-half needle in her back during a 2009 injection treatment for bulging and degenerative discs. \nBall's lawyer says efforts to extract the needle have failed. \nRyan Gavin, an attorney for Doty and Allied Physicians Group, said his clients are disappointed in the verdict and plan to appeal. \n(c) 2016 CBS Interactive Inc. All Rights Reserved. This material may not be published, broadcast, rewritten, or redistributed. The Associated Press contributed to this report. \n* Comment \n* Share \n* Tweet \n* Stumble \nFeatured in U.S. \nHermine barrels up East Coast, threatening millions \nForecasters warn people on Atlantic Coast to pay attention to destructive storm that left hundreds of thousands without power \nSource: Suspect in decades-old kidnapping gives FBI a lead \nJacob Wetterling was 11 when he was kidnapped by a masked gunman in Minnesota in 1989 \nPopular \nMost Popular \nOlympian Kerri Walsh Jennings boycotting beach volleyball event in Chicago \n358973 views \nRory Feek on mourning and life without Joey \n140644 views \nVideo shows boy thrown from rail bridge into river \n122969 views \nMother brought to tears by FSU player's sweet gesture toward son with autism \n111917 views \nWatch CBS N Live \nTeenager Dies From Hickey Girlfriend Gave Him \nChina Doesn't Give Obama Stairs To Get Off Air Force One \nBaby 's \" Evil Laugh\" Goes Viral \nBreaking Down The Latest Polls \nPhilippine President: Obama Is A Son Of A B*tch \nPlay Video \nTrump woos Ohio \nPrevious Next \nMost Discussed \nTrump, Mexican President discuss border wall in Mexico City \nTrump doubles down in immigration speech: \"Mexico will pay for the wall\" \nTrump promises \"civil rights agenda\" at Detroit church", "external_links": [], "published": "2016-09-05T03:00:00.000+03:00", "crawled": "2016-09-06T08:10:07.102+03:00", "highlightTitle": ""}