{"organizations": [], "uuid": "4c509bbefd880649023db04b39076492eaa6677d", "thread": {"social": {"gplus": {"shares": 0}, "pinterest": {"shares": 0}, "vk": {"shares": 0}, "linkedin": {"shares": 0}, "facebook": {"likes": 0, "shares": 0, "comments": 0}, "stumbledupon": {"shares": 0}}, "site_full": "www.wopular.com", "main_image": "", "site_section": "http://www.wopular.com/rss/sections/585", "section_title": "RSS: news", "url": "http://www.wopular.com/promising-outsiders-trump-team-led-christie-insiders-4", "country": "US", "title": "Promising outsiders, Trump team led by Christie insiders", "performance_score": 0, "site": "wopular.com", "participants_count": 1, "title_full": "Promising outsiders, Trump team led by Christie insiders", "spam_score": 0.0, "site_type": "news", "published": "2016-09-04T23:48:00.000+03:00", "replies_count": 0, "uuid": "4c509bbefd880649023db04b39076492eaa6677d"}, "author": "senh", "url": "http://www.wopular.com/promising-outsiders-trump-team-led-christie-insiders-4", "ord_in_thread": 0, "title": "Promising outsiders, Trump team led by Christie insiders", "locations": [], "entities": {"persons": [{"name": "donald trum", "sentiment": "none"}, {"name": "flake", "sentiment": "none"}, {"name": "donald trump", "sentiment": "none"}, {"name": "trump", "sentiment": "none"}, {"name": "gary johnson", "sentiment": "none"}, {"name": "wopular  wopular", "sentiment": "none"}, {"name": "cruz back-stabs trump", "sentiment": "none"}, {"name": "hillary clinton", "sentiment": "none"}, {"name": "carson", "sentiment": "none"}, {"name": "ted cruz", "sentiment": "none"}, {"name": "senh duong", "sentiment": "none"}, {"name": "reuters/aaron p. bernstein", "sentiment": "none"}, {"name": "cruz", "sentiment": "none"}, {"name": "rudy giuliani", "sentiment": "none"}, {"name": "yougov", "sentiment": "none"}, {"name": "giuliani", "sentiment": "none"}], "locations": [{"name": "trenton", "sentiment": "none"}, {"name": "n.j.", "sentiment": "none"}, {"name": "new york city", "sentiment": "none"}, {"name": "minnesota", "sentiment": "none"}, {"name": "usa", "sentiment": "none"}, {"name": "washington", "sentiment": "none"}, {"name": "kentucky", "sentiment": "none"}, {"name": "lexington", "sentiment": "none"}, {"name": "new jersey", "sentiment": "none"}], "organizations": [{"name": "bing", "sentiment": "none"}, {"name": "trump", "sentiment": "none"}, {"name": "ap", "sentiment": "none"}, {"name": "christie", "sentiment": "none"}, {"name": "gop", "sentiment": "none"}, {"name": "rnc", "sentiment": "none"}, {"name": "transylvania university", "sentiment": "none"}, {"name": "washington post", "sentiment": "none"}, {"name": "cnn", "sentiment": "none"}, {"name": "cbsnews", "sentiment": "none"}, {"name": "arizona gop", "sentiment": "none"}, {"name": "usa today", "sentiment": "none"}, {"name": "face the nation", "sentiment": "none"}, {"name": "cbs", "sentiment": "none"}]}, "highlightText": "", "language": "english", "persons": [], "text": "BING NEWS: Promising outsiders, Trump team led by Christie insiders TRENTON, N.J. (AP) — Donald Trump is pledging that the government he appoints will bring sweeping change to Washington's culture. So far, that promise comes with a heavy New Jersey accent. Despite being passed over for the job of Trump's running mate ... 09/2/2016 - 6:40 pm | View Website OnPolitics | USA TODAY's politics blog USA Today politics blog ... Most Popular. Meet the man making money off Donald Trump 1.1k Shares 08/30/2016 - 10:47 pm | View Website Entertainment News, Celebrity and Pop Culture Get the latest entertainment news, celebrity interviews and pop culture pulse on movies, TV and music and more at ABCNews.com. 08/30/2016 - 1:00 pm | View Website Ted Cruz easily wins straw poll of Minnesota Republican ... It was also a surprising outcome for the two most nontraditional Republican candidates, Trump and Carson, who have both led various polls and sucked up much of the ... 08/29/2016 - 7:06 pm | View Website Snake! Cruz back-stabs Trump at RNC Put yourself in Cruz’s shoes. If Trump called you a liar, then said the below things about your wife and your father, could you endorse him? NEXT Welcome to Wopular \nWopular is an online newspaper rack , giving you a summary view of the top headlines from the top news sites. Senh Duong (Founder) Arizona GOP Sen. blasts Trump’s “360-degree pivot” on immigration CBSNews , Sunday - 09/04/2016 - 02:21 PM \n“Some people said it was hardening, some said softening, I say it was just confusing,” Flake told CBS' \"Face the Nation\" Sunday Washington Post , Sunday - 09/04/2016 - 10:59 AM \nWhat if the 2016 electorate looked or voted like the electorate in 1980? Giuliani: Trump no longer wants mass deportations CNN , Sunday - 09/04/2016 - 10:25 AM \nDonald Trump in a recent speech was actually backing away from one of his most controversial GOP primary-season immigration proposals -- mass deportations -- former New York City Mayor Rudy Giuliani said on Sunday. A revolution delayed: Young people trend left, but stay home on Election Day Salon , Sunday - 09/04/2016 - 09:56 AM \nSupporters cheer Hillary Clinton at Transylvania University in Lexington, Kentucky, May 16, 2016. (Credit: Reuters/Aaron P. Bernstein) According to the latest YouGov data, Donald Trump would narrowly win an election if only those 65 or older voted. But if just people under 30 voted, he would not only lose in a landslide, he would also come close to being eclipsed by the Libertarian third-party candidate, Gary Johnson. During the Democratic primary, one of the most important divides was along age lines: Young people across race and gender lines were more supportive of Sen.", "external_links": [], "published": "2016-09-04T23:48:00.000+03:00", "crawled": "2016-09-04T18:58:48.311+03:00", "highlightTitle": ""}