{"organizations": [], "uuid": "c8ed56a4e7e51434670aba07271231eae2a9c7d4", "thread": {"social": {"gplus": {"shares": 0}, "pinterest": {"shares": 0}, "vk": {"shares": 0}, "linkedin": {"shares": 1}, "facebook": {"likes": 44, "shares": 44, "comments": 0}, "stumbledupon": {"shares": 0}}, "site_full": "www.foxnews.com", "main_image": "http://a57.foxnews.com/images.foxnews.com/content/fox-news/entertainment/slideshow/2016/09/02/stars-who-lost-their-mojo/_jcr_content/slideshow-par/slide_image_3/image.img.jpg/0/0/1472831736358.jpg?ve=1", "site_section": "http://feeds.foxnews.com/foxnews/latest", "section_title": "FOXNews.com", "url": "http://www.foxnews.com/entertainment/slideshow/2016/09/02/stars-who-lost-their-mojo.html", "country": "CH", "domain_rank": 185, "title": "Brolin lets himself go", "performance_score": 0, "site": "foxnews.com", "participants_count": 1, "title_full": "Brolin lets himself go", "spam_score": 0.0, "site_type": "news", "published": "2016-09-03T00:20:00.000+03:00", "replies_count": 0, "uuid": "c8ed56a4e7e51434670aba07271231eae2a9c7d4"}, "author": "foxnewsonline@foxnews.com (Fox News Online)", "url": "http://www.foxnews.com/entertainment/slideshow/2016/09/02/stars-who-lost-their-mojo.html", "ord_in_thread": 0, "title": "Brolin lets himself go", "locations": [], "entities": {"persons": [{"name": "josh", "sentiment": "neutral"}, {"name": "brolin", "sentiment": "neutral"}, {"name": "josh brolin", "sentiment": "neutral"}, {"name": "goldie hawn  goldie hawn", "sentiment": "none"}, {"name": "tori spelling tori spelling", "sentiment": "none"}, {"name": "santa claus", "sentiment": "none"}, {"name": "russell crowe  russell crowe", "sentiment": "none"}, {"name": "getty", "sentiment": "none"}, {"name": "jennifer garner", "sentiment": "none"}, {"name": "nick nolte  nick nolte", "sentiment": "none"}, {"name": "garner", "sentiment": "none"}, {"name": "ben affleck", "sentiment": "none"}, {"name": "davis", "sentiment": "none"}, {"name": "kurt russel  kurt russel", "sentiment": "none"}, {"name": "liam neeson  liam neeson", "sentiment": "none"}, {"name": "affleck", "sentiment": "none"}, {"name": "katheryn boyd", "sentiment": "none"}, {"name": "marshall bruce mathers", "sentiment": "none"}, {"name": "mel gibson", "sentiment": "none"}, {"name": "kristin davis", "sentiment": "none"}, {"name": "mickey rourke", "sentiment": "none"}, {"name": "leonardo dicaprio  leonardo dicaprio", "sentiment": "none"}, {"name": "james dean", "sentiment": "none"}, {"name": "randy quaid  randy quaid", "sentiment": "none"}, {"name": "crowe", "sentiment": "none"}, {"name": "rosanna arquette  rosanna arquette", "sentiment": "none"}, {"name": "johnny depp", "sentiment": "none"}, {"name": "maria shriver", "sentiment": "none"}, {"name": "dicaprio", "sentiment": "none"}, {"name": "demi moore demi moore", "sentiment": "none"}, {"name": "carlos herrera", "sentiment": "none"}, {"name": "dean mcdermott", "sentiment": "none"}, {"name": "gibson", "sentiment": "none"}, {"name": "matthew perry  matthew perry", "sentiment": "none"}, {"name": "kate hudson", "sentiment": "none"}, {"name": "johnny depp  johnny depp", "sentiment": "none"}, {"name": "eminem", "sentiment": "none"}, {"name": "david letterman  david letterman", "sentiment": "none"}, {"name": "susan", "sentiment": "none"}, {"name": "nolte", "sentiment": "none"}, {"name": "josh radnor  josh radnor", "sentiment": "none"}], "locations": [{"name": "miami river", "sentiment": "none"}, {"name": "nyc", "sentiment": "none"}, {"name": "new mexico", "sentiment": "none"}, {"name": "soho", "sentiment": "none"}, {"name": "london", "sentiment": "none"}, {"name": "italy", "sentiment": "none"}, {"name": "california", "sentiment": "none"}, {"name": "new york city", "sentiment": "none"}, {"name": "montreal", "sentiment": "none"}, {"name": "u.s.", "sentiment": "none"}, {"name": "canada", "sentiment": "none"}, {"name": "seaspice", "sentiment": "none"}, {"name": "beverly hills", "sentiment": "none"}, {"name": "radnor", "sentiment": "none"}], "organizations": [{"name": "hollywoodlife.com", "sentiment": "none"}, {"name": "earls court", "sentiment": "none"}, {"name": "taryn manning  taryn manning", "sentiment": "none"}, {"name": "reuters", "sentiment": "none"}, {"name": "ap", "sentiment": "none"}, {"name": "refugee board", "sentiment": "none"}]}, "highlightText": "", "language": "english", "persons": [], "text": "Stars who lost their mojo FoxNews.com http://www.foxnews.com/ Josh Brolin The typically dapper Josh Brolin has really let himself go! The actor shared a picture of himself with fiance Katheryn Boyd (right) after visiting New Mexico. He looks years younger just one year ago (left). Click here for more pics of the star on Hollywoodlife.com . Reuters/Instagram josh-brolin Tori Spelling Tori Spelling is not looking good. She stepped out (left) with greasy, disheveled hair after being hit with a tax lien . She looked a lot better in 2006 (right). Spelling has hit hard times this past decade -- her husband and the father of her 4 children Dean McDermott cheated on her, she's gone broke and owes the government a lot of money in unpaid taxes. See Spelling's shocking transformation here . Blink-News/Reuters tori-spelling Ben Affleck Divorce does not look good on Ben Affleck. The star who split with ex Jennifer Garner in 2015 seems to have gained some weight since he walked the red carpet in 2014 (right). Affleck, who is still legally married to Garner, has definitely seen better days. Click here for more pictures of the star on X17online.com . Reuters/X17 ben-affleck Demi Moore Demi Moore didn't look her best (right) when she stepped out to eat. The actress looked more put together in 2009. Click here for more pictures of the star. AKM-GSI demi-moore Maria Shriver It seems the past few years have taken a toll of Maria Shriver. She looks a bit scary in these recent photos. Click here for more from X17 . X17/AP maria-shriver Josh Radnor \nJosh Radnor isn't looking his best these days. The former \"How I Met Your Mother\" star looked clean-shaven and happy in 2014 (right) but recently stepped out looking like a mess. It's unclear whether Radnor's new look is for a movie or TV role. Click here for more must-see star sightings . Reuters/Getty josh-radnor Kurt Russel \nKurt Russel is looking shabbier than usual. The actor stepped out at LAX (left) with a full beard and messy hair. We prefer the actor clean-shaven and in a suit. X17/Reuters kurt-russel Nick Nolte \nNick Nolte looked like a mess when he recently stepped out (left) in Beverly Hills. The actor is a far cry from his clean-shaven self back in 2011 (right). Click here for more pictures of Nolte on X17online.com . X17/Reuters nick-nolte Kristin Davis \nThe \"Sex and the City\" star stepped out looking less than her usual self. Davis donned a frumpy shirt and sweater and her hair looked like she just rolled out of bed. She looked happier (right) a year ago. Click here for more pictures of Davis on X17online.com . X17/Reuters kristin-davis David Letterman \nDavid Letterman channeled Santa Claus as he arrived at his New York City apartment. The former late night talk show host is clearly taking his retirement beard to the next level. He's not the only star who has been looking disheveled these days: You'll never guess what Johnny Depp looks like now . AP/Startraks david-letterman Randy Quaid \nRandy Quaid arrived at his Immigration and Refugee Board hearing in Montreal Oct. 8, 2015 sporting a full beard and disheveled, long hair. The actor said in an interview that he could be deported from Canada next week and that he would like to resolve his legal issues in California and \"move on with my life.\" The actor and his Canadian wife fled the U.S. in 2010, saying they were victims of persecution. AP randy-quaid Johnny Depp \nJohnny Depp looked considerably older when he stepped out in Italy at the 72nd Venice Film Festival. It might just be the fake teeth, but the actor appears to have packed on a few pounds and is dangerously close to losing his heartthrob status. Reuters johnny-depp Liam Neeson \nLiam Neeson didn't look his best when he went for a stroll. The \"Taken\" star looked frail and gaunt but his rep told TMZ he's \"healthy as ever.\" Click here for more celebrity sightings . Reuters/Getty liam-neeson Russell Crowe \nRussell Crowe looked a lot heavier (left) and a little more grey as he stepped out to go furniture shopping in Beverly Hills. Click here for more pictures of Crowe on X17online.com . X17/Reuters russell-crowe Taryn Manning \nTaryn Manning looked rough after leaving dinner with friends. The \"Orange is the New Black\" star definitely needs a makeover and some sleep. Click here for more pictures of the actress on X17online.com . X17/Reuters taryn-manning Leonardo Dicaprio \nLeonardo DiCaprio went almost undetected in NYC's Soho neighborhood. The star looked disheveled with an unruly beard and his long hair pulled up into a bun. If DiCaprio was trying to fly under the radar, he nearly succeeded. MORE: One star, two looks. Reuters/Splash leonardo-dicaprio Matthew Perry \nMatthew Perry is looking very different from his \"Friends\" days. The 45-year-old star stepped out looking heavier in a stained black shirt with noticeably grayer hair at LAX. Click here for more pictures of the \"Odd Couple\" star from X17online.com . X17/Reuters matthew-perry Rosanna Arquette \nRosanna Arquette stepped out for dinner with friends (left) looking a little less than her usual put-together self. Click here for more pics of the \"Desperately Seeking Susan\" star from X17online.com . X17/Reuters rosanna-arquette Goldie Hawn \nGoldie Hawn looked worse for wear (left) while visiting the Seaspice restaurant on the Miami River with a friend. The actress sported a bright orange Sarong styled as a dress over a bathing suit on her girls day out. Kate Hudson's mama, pictured right in 2001, has definitely seen better days. Carlos Herrera Movil/AP goldie-hawn Eminem: Now \nEminem looked well past his 42-years at an event in New York City. The rapper, whose real name is Marshall Bruce Mathers, has openly admitted to drug and alcohol abuse in his past. Click here for more pictures of the rapper. Getty eminem:-now Eminem: Then \nA much younger looking Eminem speaks to the crowd after winning Best International Artist during the Brit Awards at the Earls Court arena in London February 26, 2001. Reuters eminem:-then Mickey Rourke: Now \nThe star of \"The Wrestler\" is now the poster child for the dangerous cocktail that is multiple fist fights and multiple plastic surgeries. Although given his string of model girlfriends, the ladies don't seem to mind. Click here for more pictures of the actor on X17online.com . X17online mickey-rourke:-now Mickey Rourke: Then \nThe one-time boxer oozed sex appeal in his early roles in the 80s and 90s. Critics touted him as the next James Dean. AP mickey-rourke:-then Mel Gibson: Then \nBefore he was accused of being \"abusive\" and \"racist,\" Gibson was the cute new guy on the scene, starring in \"Mad Max\" (1979) and \"Lethal Weapon\" (1987). \n(AP) mel-gibson:-then Mel Gibson: Now", "external_links": [], "published": "2016-09-03T00:20:00.000+03:00", "crawled": "2016-09-02T19:52:31.853+03:00", "highlightTitle": ""}