{"organizations": [], "uuid": "2f2da8abae05d64ca3145fda8c76eada7d5a43d5", "thread": {"social": {"gplus": {"shares": 0}, "pinterest": {"shares": 0}, "vk": {"shares": 0}, "linkedin": {"shares": 0}, "facebook": {"likes": 0, "shares": 0, "comments": 0}, "stumbledupon": {"shares": 0}}, "site_full": "drugpolicycentral.com", "main_image": "", "site_section": "http://drugpolicycentral.com/bot/rss", "section_title": "breaking drug news latest 25", "url": "http://drugpolicycentral.com/bot/xarticle/cbsnews7653.htm", "country": "CA", "title": "Combating heroin overdoses in \"America's Hometown\" - Videos - CBS News", "performance_score": 0, "site": "drugpolicycentral.com", "participants_count": 1, "title_full": "[BOT] Combating heroin overdoses in \"America's Hometown\" - Videos - CBS News", "spam_score": 0.0, "site_type": "news", "published": "2016-09-04T03:00:00.000+03:00", "replies_count": 0, "uuid": "2f2da8abae05d64ca3145fda8c76eada7d5a43d5"}, "author": "drugpolicycentral.com", "url": "http://drugpolicycentral.com/bot/xarticle/cbsnews7653.htm", "ord_in_thread": 0, "title": "Combating heroin overdoses in \"America's Hometown\" - Videos - CBS News", "locations": [], "entities": {"persons": [{"name": "hillary clinton", "sentiment": "none"}, {"name": "clinton", "sentiment": "none"}, {"name": "alberto gonzales", "sentiment": "none"}, {"name": "trump", "sentiment": "none"}, {"name": "jacob wetterling", "sentiment": "none"}, {"name": "jeff flake", "sentiment": "none"}, {"name": "mike pence", "sentiment": "none"}, {"name": "mother teresa", "sentiment": "none"}, {"name": "chris christie", "sentiment": "none"}, {"name": "christie", "sentiment": "none"}, {"name": "hermine", "sentiment": "none"}], "locations": [{"name": "america", "sentiment": "none"}, {"name": "us", "sentiment": "none"}, {"name": "north carolina", "sentiment": "none"}, {"name": "pennsylvania", "sentiment": "none"}], "organizations": [{"name": "cbs news", "sentiment": "none"}, {"name": "cbs news combating", "sentiment": "none"}, {"name": "cbs evening news", "sentiment": "none"}, {"name": "northeast", "sentiment": "none"}, {"name": "gop", "sentiment": "none"}, {"name": "cbs interactive inc", "sentiment": "none"}, {"name": "cbs", "sentiment": "none"}]}, "highlightText": "", "language": "english", "persons": [], "text": "This newsbot site, while automated (true!) has always depended on the generosity of volunteers and visitors to keep it up and running. If this site has helped you, and you can afford to help us , then we ask you to give generously. And to those who have been helping to keep us running, a heartfelt  THANK YOU!       Donate online: click here and help us out! \nUS: Combating heroin overdoses in \"America's Hometown\" - Videos - CBS News \nFound: Sun Sep 04 21:54:05 2016 PDT\nWebpage: http://www.cbsnews.com/videos/combating-he... [translate] \nNewshawk: http://drugpolicycentral.com/bot/ \n\n\ntopical analysis prison was NOT mentioned \npropaganda analysis \nCombating heroin overdoses in \" America 's Hometown\" - Videos - CBS News Combating heroin overdoses in \" America 's Hometown\" - Videos - CBS News \n* CBS News \n* CBS Evening News \n* CBS This Morning \nWhere is Hermine headed? \nG-20 Summit begins with hopes for U.S.-Russia deal to end Syrian fighting \nClinton leads in key battleground states at Labor Day mark \nRemains of Jacob Wetterling, missing since 1989, found \nHacking Your Phone \nHacking Your Phone, 30 Years on Death Row, The Collider \nHow strangers can hack your phone \nHacking into a congressman's phone \n9/4: Hermine may regain hurricane status; Cancer patients find healing with horses \nCBS News poll shows Trump trailing Clinton in key states \nChris Christie : Trump is \"candid\" on immigration \nRemains of boy missing since 1989 found \nMike Pence attacks Hillary Clinton over private email server \nNortheast braces for dangerous storm surge \nMother Teresa becomes a saint \nWhat are Clinton's and Trump's hurdles in the final stretch? \nAlberto Gonzales discusses enhanced interrogation \nAlberto Gonzales on the type of person it takes to be president \nFTN: Page 2 \nBattleground Tracker: Clinton leads in North Carolina, Pennsylvania \nJeff Flake on supporting Trump: It's becoming increasingly difficult \nGOP senator: Trump's immigration plan \"just confusing\" \nChristie pushes back on \"pay to play\" allegations for Trump charity \n* Share \n* Tweet \n* CBS Local \nGO \n* (c) 2016 CBS Interactive Inc. All rights reserved. \n* Mobile User Agreement / About CBS \n* Advertise / Closed Captioning \nThis page was seen on the cbsnews.com host.", "external_links": [], "published": "2016-09-04T03:00:00.000+03:00", "crawled": "2016-09-05T08:05:47.279+03:00", "highlightTitle": ""}