{"organizations": [], "uuid": "90673c0050296c50ccb5f83e178b492da50ce5bf", "thread": {"social": {"gplus": {"shares": 0}, "pinterest": {"shares": 0}, "vk": {"shares": 0}, "linkedin": {"shares": 0}, "facebook": {"likes": 0, "shares": 0, "comments": 0}, "stumbledupon": {"shares": 0}}, "site_full": "www.nbcnews.com", "main_image": "http://media2.s-nbcnews.com/j/newscms/2016_35/1691861/aguilar_f31de2966a1d2e0e250dd9bca0df910e.nbcnews-fp-1200-800.jpg", "site_section": "", "section_title": "", "url": "http://www.nbcnews.com/politics/2016-election/alfonso-aguilar-feels-misled-trump-s-immigration-plan-n641091", "country": "US", "domain_rank": 478, "title": "Alfonso Aguilar Feels 'Misled' on Trump's Immigration Plan - NBC News", "performance_score": 0, "site": "nbcnews.com", "participants_count": 0, "title_full": "Alfonso Aguilar Feels 'Misled' on Trump's Immigration Plan - NBC News", "spam_score": 0.145, "site_type": "news", "published": "2016-09-01T08:00:00.000+03:00", "replies_count": 0, "uuid": "90673c0050296c50ccb5f83e178b492da50ce5bf"}, "author": "F. Brinley Bruton", "url": "http://www.nbcnews.com/politics/2016-election/alfonso-aguilar-feels-misled-trump-s-immigration-plan-n641091", "ord_in_thread": 0, "title": "Alfonso Aguilar Feels 'Misled' on Trump's Immigration Plan - NBC News", "locations": [], "entities": {"persons": [{"name": "f. brinley brut", "sentiment": "negative"}, {"name": "alfonso aguilar", "sentiment": "negative"}, {"name": "clinton", "sentiment": "none"}, {"name": "donald trump", "sentiment": "none"}, {"name": "trump", "sentiment": "none"}, {"name": "politico", "sentiment": "none"}, {"name": "aguilar", "sentiment": "none"}, {"name": "katy tur share trump", "sentiment": "none"}, {"name": "rudy giuliani", "sentiment": "none"}, {"name": "enrique peña nieto", "sentiment": "none"}, {"name": "jeff sessions", "sentiment": "none"}], "locations": [{"name": "united states", "sentiment": "none"}, {"name": "mexico", "sentiment": "none"}, {"name": "arizona", "sentiment": "none"}, {"name": "phoenix", "sentiment": "none"}], "organizations": [{"name": "nbc news sep", "sentiment": "negative"}, {"name": "trump", "sentiment": "negative"}, {"name": "nbc news", "sentiment": "none"}, {"name": "the washington post", "sentiment": "none"}]}, "highlightText": "", "language": "english", "persons": [], "text": "Sep 1 2016, 6:09 am ET Alfonso Aguilar Feels 'Misled' on Trump's Immigration Plan by F. Brinley Bruton and Katy Tur Share Trump Outlines 10-Point Plan for Immigration Reform 4:22 autoplay autoplay Copy this code to your website or blog <iframe src=\"http://www.nbcnews.com/widget/video-embed/755598915872\" width=\"560\" height=\"315\" frameborder=\"0\" allowfullscreen></iframe> — Alfonso Aguilar (@amigoaguilar) September 1, 2016 \n\"There will be no amnesty,\" Trump told the crowd in Phoenix, Arizona. \"Our message to the world will be this: You cannot obtain legal status or become a citizen of the United States by illegally entering our country.\" \nIn addition to his tweet, Aguilar told Politico: \"It's so disappointing because we feel we took a chance, a very risky chance.\" \nHe added: \"We decided to make a big U-turn to see if we could make him change. We thought we were moving in the right direction … we're disappointed. We feel misled.\" \nNBC News tried to contact Aguilar, but he was not immediately available for comment. Trump: New immigration laws will be enforced 6:17 autoplay autoplay Copy this code to your website or blog <iframe src=\"http://www.nbcnews.com/widget/video-embed/755601475858\" width=\"560\" height=\"315\" frameborder=\"0\" allowfullscreen></iframe> \nAguilar had been vehemently opposed to a Trump candidacy before joining a group of Latino conservatives to declare their support for the Republican in a letter on July 18, according to The Washington Post . \nPolitico quoted him Thursday as saying \"there's a real possibility we will withdraw support from Donald Trump because of that disappointing speech.\" \nHowever, Aguilar reportedly said he had no plans to support Clinton. \nTrump's Arizona speech came just hours after the candidate appeared in Mexico, where he struck a more conciliatory tone after meeting with Mexican President Enrique Peña Nieto. \nTrump's warm-up speakers — Rudy Giuliani and Sen. Jeff Sessions — wore \"Make Mexico Great Again Also\" hats. Play ", "external_links": [], "published": "2016-09-01T08:00:00.000+03:00", "crawled": "2016-09-01T13:17:11.203+03:00", "highlightTitle": ""}